{
  "barrio": "Recoleta",
  "comuna": 2,
  "zona": "Norte",
  "mes": "noviembre",
  "a√±o": 2025,
  "fecha_consulta": "2025-11-09",
  "fuente": "Gemini AI",
  "descripcion": "Recoleta es uno de los barrios con mayor concentraci√≥n de actividades culturales y tur√≠sticas en Buenos Aires",
  "centro_cultural_recoleta": {
    "nombre": "Centro Cultural Recoleta (CCR)",
    "descripcion": "Epicentro de actividades, la mayor√≠a gratuitas, y tiene una agenda muy activa durante todo el mes",
    "eventos": [
      {
        "titulo": "Exposiciones Permanentes",
        "fecha": "Martes a Domingo",
        "lugar": "Salas 1 a 13 y de Exposici√≥n",
        "descripcion": "Muestras inauguradas para el 45¬∞ Aniversario, incluyendo obras de Bedel, Benedit, Testa, y la exposici√≥n 'C√©sar Aira: medio siglo de literatura' (Salas 2 y 3)",
        "categoria": "cultural",
        "tipo": "exposicion",
        "precio": "Gratis"
      },
      {
        "titulo": "Muestras Nuevas",
        "fecha": "2025-11-13",
        "horario": "A partir de las 18:00 hs",
        "lugar": "Varias Salas",
        "descripcion": "Inauguran las exposiciones 'Pol√≠ticas del sabor', 'Visi√≥n imposible' y 'Fronteras blandas'",
        "categoria": "cultural",
        "tipo": "exposicion",
        "precio": "Gratis"
      },
      {
        "titulo": "Cine: Ciclo BAFICI",
        "fecha": "Todos los Martes",
        "horario": "19:00 hs",
        "lugar": "Salas de Cine del CCR",
        "descripcion": "Proyecciones seleccionadas del Festival de Cine de Buenos Aires (BAFICI)",
        "categoria": "cultural",
        "tipo": "cine",
        "precio": "Gratis",
        "recurrente": true
      },
      {
        "titulo": "Cine: Los mundos √©picos de Ralph Bakshi",
        "fecha": "Todos los Viernes",
        "horario": "18:00 hs",
        "lugar": "Salas de Cine del CCR",
        "descripcion": "Proyecciones de este autor brit√°nico",
        "categoria": "cultural",
        "tipo": "cine",
        "precio": "Gratis",
        "recurrente": true
      },
      {
        "titulo": "Festival Retrat√≥n",
        "fecha": "2025-11-15",
        "horario": "15:00 a 20:00 hs",
        "lugar": "Centro Cultural Recoleta",
        "descripcion": "Actividad de fotograf√≠a y retratos",
        "categoria": "cultural",
        "tipo": "fotografia",
        "precio": "Gratis"
      },
      {
        "titulo": "M√∫sica: Entrel√≠neas Quinteto",
        "fecha": "2025-11-15",
        "horario": "18:00 hs",
        "lugar": "Centro Cultural Recoleta",
        "descripcion": "Espect√°culo musical",
        "categoria": "cultural",
        "tipo": "musica",
        "precio": "Gratis"
      },
      {
        "titulo": "Cine: Pel√≠cula Sorpresa",
        "fecha": "2025-11-16",
        "horario": "18:00 hs",
        "lugar": "Salas de Cine del CCR",
        "descripcion": "Proyecci√≥n sorpresa",
        "categoria": "cultural",
        "tipo": "cine",
        "precio": "Gratis"
      },
      {
        "titulo": "M√∫sica: Antidomingos",
        "fecha": "Todos los Domingos (ejemplo: Hoy 9 de Nov.)",
        "horario": "19:00 hs",
        "lugar": "Centro Cultural Recoleta",
        "descripcion": "Ciclo de m√∫sica, hoy con Julieta Kitman y Angel Sucheras",
        "categoria": "cultural",
        "tipo": "musica",
        "precio": "Gratis",
        "recurrente": true
      },
      {
        "titulo": "M√∫sica: Dos a Cu4tro ‚Äì Bollero & Wainz",
        "fecha": "2025-11-22",
        "horario": "17:00 hs",
        "lugar": "Centro Cultural Recoleta",
        "descripcion": "Presentaci√≥n musical",
        "categoria": "cultural",
        "tipo": "musica",
        "precio": "Gratis"
      },
      {
        "titulo": "Charla: Cicatrices (Poes√≠a)",
        "fecha": "2025-11-25",
        "horario": "19:00 hs",
        "lugar": "Centro Cultural Recoleta",
        "descripcion": "Ciclo de lectura de poes√≠a",
        "categoria": "cultural",
        "tipo": "literatura",
        "precio": "Gratis"
      },
      {
        "titulo": "M√∫sica: N√©lida S√°nchez - Piano",
        "fecha": "2025-11-29",
        "horario": "19:00 hs",
        "lugar": "Centro Cultural Recoleta",
        "descripcion": "Concierto de piano",
        "categoria": "cultural",
        "tipo": "musica",
        "precio": "Gratis"
      }
    ]
  },
  "ferias_paseos_tradicionales": [
    {
      "titulo": "Feria de Artesanos de Plaza Francia",
      "fecha": "Todos los S√°bados, Domingos y Feriados",
      "horario": "11:00 a 20:00 hs",
      "lugar": "Plaza Intendente Alvear",
      "direccion": "Junto a Av. del Libertador y Av. Pueyrred√≥n",
      "descripcion": "Conocida popularmente como 'la Feria de Plaza Francia'. Es la feria de artesan√≠as m√°s famosa de la ciudad, con m√∫sica, espect√°culos callejeros y much√≠simos puestos de dise√±o, arte y joyer√≠a.",
      "categoria": "feria",
      "tipo": "artesanias",
      "precio": "Gratis entrada",
      "recurrente": true
    },
    {
      "titulo": "Cementerio de la Recoleta",
      "fecha": "Diario",
      "horario": "9:00 a 17:00 hs",
      "lugar": "Cementerio de la Recoleta",
      "direccion": "Jun√≠n 1760",
      "descripcion": "M√°s all√° de su valor hist√≥rico y arquitect√≥nico (con el mausoleo de Eva Per√≥n), se ofrecen visitas guiadas gratuitas en diferentes horarios.",
      "categoria": "turismo",
      "tipo": "historico",
      "precio": "Gratis con DNI"
    },
    {
      "titulo": "Plaza Houssay (Feria Gastron√≥mica)",
      "fecha": "Fines de Semana",
      "lugar": "Plaza Houssay",
      "direccion": "Av. C√≥rdoba y Jun√≠n",
      "descripcion": "Aunque m√°s enfocada en la oferta estudiantil y universitaria, los fines de semana suelen haber puestos de comida street food y un ambiente animado.",
      "categoria": "gastronomia",
      "tipo": "feria",
      "precio": "Gratis entrada"
    }
  ],
  "vida_nocturna_premium": [
    {
      "tipo": "Milongas de Tango",
      "descripcion": "La zona cercana a Recoleta (como la Galer√≠a Pac√≠fico, o salones de hoteles) suele tener milongas o clases de tango abiertas a la comunidad, especialmente los mi√©rcoles y s√°bados por la noche.",
      "categoria": "entretenimiento",
      "dias_principales": ["mi√©rcoles", "s√°bados"]
    },
    {
      "tipo": "Hoteles y Bares Premium",
      "lugares": ["Alvear Palace Hotel", "Four Seasons"],
      "descripcion": "Los bares de hoteles suelen tener m√∫sica en vivo (jazz, piano, DJ sets) los fines de semana, ofreciendo un ambiente de fiesta sofisticada.",
      "categoria": "vida_nocturna",
      "precio": "Premium"
    }
  ],
  "iconos_turisticos": [
    {
      "nombre": "Centro Cultural Recoleta",
      "tipo": "cultural"
    },
    {
      "nombre": "Cementerio de la Recoleta",
      "tipo": "historico",
      "destaca": "Mausoleo de Eva Per√≥n"
    },
    {
      "nombre": "Plaza Francia",
      "tipo": "plaza_feria"
    },
    {
      "nombre": "Alvear Palace Hotel",
      "tipo": "hotel_historico"
    }
  ],
  "caracteristicas": {
    "enfoque": "cultural_turistico",
    "ideal_para": ["cultura", "arte", "historia", "ferias_artesanales", "turismo"],
    "publico": "adulto_turistas",
    "ambiente": "sofisticado_cultural"
  },
  "total_eventos": 17,
  "respuesta_completa": "¬°Recoleta es uno de los barrios con mayor concentraci√≥n de actividades culturales y tur√≠sticas en Buenos Aires!\n\nBasado en la agenda para lo que resta de noviembre de 2025 (desde hoy, domingo 9), aqu√≠ tienes los principales eventos, ferias y actividades:\n\nüèõÔ∏è Centro Cultural Recoleta (CCR)\n\nEl CCR es un epicentro de actividades, la mayor√≠a gratuitas, y tiene una agenda muy activa durante todo el mes.\n\nEvento/Actividad\tFecha\tLugar\tNotas/Detalles\nExposiciones Permanentes\tMartes a Domingo\tSalas 1 a 13 y de Exposici√≥n\tSe mantienen las muestras inauguradas para el 45¬∞ Aniversario, incluyendo obras de Bedel, Benedit, Testa, y la exposici√≥n \"C√©sar Aira: medio siglo de literatura\" (Salas 2 y 3).\nMuestras Nuevas\tJueves 13 de Noviembre\tVarias Salas\tInauguran las exposiciones \"Pol√≠ticas del sabor\", \"Visi√≥n imposible\" y \"Fronteras blandas\" (A partir de las 18:00 hs).\nCine: Ciclo BAFICI\tTodos los Martes\tSalas de Cine del CCR\tProyecciones seleccionadas del Festival de Cine de Buenos Aires (BAFICI). (Suelen ser a las 19:00 hs).\nCine: Los mundos √©picos de Ralph Bakshi\tTodos los Viernes\tSalas de Cine del CCR\tProyecciones de este autor brit√°nico. (Suele ser a las 18:00 hs).\nFestival Retrat√≥n\tS√°bado 15 de Noviembre\tCentro Cultural Recoleta\tActividad de fotograf√≠a y retratos. (De 15:00 a 20:00 hs).\nM√∫sica: Entrel√≠neas Quinteto\tS√°bado 15 de Noviembre\tCentro Cultural Recoleta\tEspect√°culo musical. (A las 18:00 hs).\nCine: Pel√≠cula Sorpresa\tDomingo 16 de Noviembre\tSalas de Cine del CCR\tProyecci√≥n sorpresa. (A las 18:00 hs).\nM√∫sica: Antidomingos\tTodos los Domingos (ej. Hoy 9 de Nov.)\tCentro Cultural Recoleta\tCiclo de m√∫sica, hoy con Julieta Kitman y Angel Sucheras. (A las 19:00 hs).\nM√∫sica: Dos a Cu4tro ‚Äì Bollero & Wainz\tS√°bado 22 de Noviembre\tCentro Cultural Recoleta\tPresentaci√≥n musical. (A las 17:00 hs).\nCharla: Cicatrices (Poes√≠a)\tMartes 25 de Noviembre\tCentro Cultural Recoleta\tCiclo de lectura de poes√≠a. (A las 19:00 hs).\nM√∫sica: N√©lida S√°nchez - Piano\tS√°bado 29 de Noviembre\tCentro Cultural Recoleta\tConcierto de piano. (A las 19:00 hs).\n\nüé® Ferias y Paseos Tradicionales\n\nEstas actividades son el coraz√≥n del fin de semana en Recoleta.\n\nEvento/Actividad\tFecha\tLugar\tNotas/Detalles\nFeria de Artesanos de Plaza Francia\tTodos los S√°bados, Domingos y Feriados (hasta fin de mes)\tPlaza Intendente Alvear (Junto a Av. del Libertador y Av. Pueyrred√≥n)\tConocida popularmente como \"la Feria de Plaza Francia\". Abierta de 11:00 a 20:00 hs. Es la feria de artesan√≠as m√°s famosa de la ciudad, con m√∫sica, espect√°culos callejeros y much√≠simos puestos de dise√±o, arte y joyer√≠a.\nCementerio de la Recoleta\tDiario\tJun√≠n 1760\tAbierto de 9:00 a 17:00 hs. M√°s all√° de su valor hist√≥rico y arquitect√≥nico (con el mausoleo de Eva Per√≥n), se ofrecen visitas guiadas gratuitas en diferentes horarios.\nPlaza Houssay (Feria Gastron√≥mica)\tFines de Semana\tAv. C√≥rdoba y Jun√≠n\tAunque m√°s enfocada en la oferta estudiantil y universitaria, los fines de semana suelen haber puestos de comida street food y un ambiente animado.\n\nüé∂ Fiestas y Vida Nocturna\n\nRecoleta es hogar de algunos de los bares y boliches m√°s exclusivos de Buenos Aires, generalmente enfocados en un p√∫blico adulto y tur√≠stico:\n\nMilongas de Tango: La zona cercana a Recoleta (como la Galer√≠a Pac√≠fico, o salones de hoteles) suele tener milongas o clases de tango abiertas a la comunidad, especialmente los mi√©rcoles y s√°bados por la noche.\n\nHoteles y Bares Premium: Los bares de hoteles como el Alvear Palace Hotel o el Four Seasons suelen tener m√∫sica en vivo (jazz, piano, DJ sets) los fines de semana, ofreciendo un ambiente de fiesta sofisticada.\n\n¬øHay alg√∫n tipo de actividad en particular que te interese m√°s (por ejemplo, cine, m√∫sica, museos o paseos al aire libre), para que te pueda dar m√°s detalles?"
}
