{
  "barrio": "Retiro",
  "comuna": 1,
  "zona": "Centro",
  "mes": "noviembre",
  "a√±o": 2025,
  "fecha_consulta": "2025-11-09",
  "fuente": "Gemini AI",
  "descripcion": "Retiro es un barrio clave que combina la historia, la cultura y un importante centro de transporte, lo que lo hace ideal para el turismo cultural",
  "palacio_libertad": {
    "nombre": "Palacio Libertad (Ex Correo Central)",
    "descripcion": "Gran centro cultural lindero a Retiro, con agenda constante de cine, m√∫sica y exposiciones",
    "eventos": [
      {
        "titulo": "La Pampa C√≥smica de P√©rez Celis (Muestra)",
        "fecha_inicio": "2025-11-12",
        "fecha_fin": "Contin√∫a hasta Diciembre",
        "horario": "14:00 a 20:00 hs",
        "lugar": "Sala Inmersiva",
        "descripcion": "Exposici√≥n - experiencia inmersiva sobre la obra del artista argentino",
        "categoria": "cultural",
        "tipo": "exposicion",
        "precio": "Consultar"
      },
      {
        "titulo": "Conciertos del Mediod√≠a - Mozarteum Argentino",
        "fecha": "Mi√©rcoles 12 y 26 de Noviembre",
        "horario": "14:00 hs",
        "lugar": "Sala Argentina",
        "descripcion": "Conciertos de m√∫sica cl√°sica de gran nivel. El 26/11, Sinfon√≠as de Mozart y Haydn",
        "categoria": "cultural",
        "tipo": "musica_clasica",
        "precio": "Consultar"
      },
      {
        "titulo": "El Camino de Manuelita (Familiar)",
        "fecha": "S√°bados 15, 22 y 29 de Noviembre (Contin√∫a en Diciembre)",
        "horario": "14:00 a 20:00 hs",
        "lugar": "Sala Inmersiva",
        "descripcion": "Experiencia inmersiva para toda la familia sobre el personaje de Mar√≠a Elena Walsh",
        "categoria": "cultural",
        "tipo": "familiar",
        "precio": "Consultar",
        "recurrente": true
      },
      {
        "titulo": "Festival Fado Buenos Aires 2025",
        "fecha": "2025-11-15",
        "horario": "20:00 hs",
        "lugar": "Auditorio Nacional",
        "descripcion": "Concierto en el marco del festival de m√∫sica portuguesa",
        "categoria": "cultural",
        "tipo": "musica",
        "precio": "Consultar"
      },
      {
        "titulo": "Homenaje a Carlos Paredes (Fado)",
        "fecha": "2025-11-16",
        "horario": "19:00 hs",
        "lugar": "Sala Argentina",
        "descripcion": "Concierto especial de Andr√© Dias y Hugo Gamboias",
        "categoria": "cultural",
        "tipo": "musica",
        "precio": "Consultar"
      },
      {
        "titulo": "Tardes del Mundo: Flamenco",
        "fecha": "2025-11-21",
        "horario": "20:00 hs",
        "lugar": "Plaza Seca",
        "descripcion": "Espect√°culo de flamenco con Maxi Serral",
        "categoria": "cultural",
        "tipo": "musica",
        "precio": "Consultar"
      },
      {
        "titulo": "Divas and Soul",
        "fecha": "2025-11-29",
        "horario": "20:00 hs",
        "lugar": "Sala Argentina",
        "descripcion": "Espect√°culo musical de Soul",
        "categoria": "cultural",
        "tipo": "musica",
        "precio": "Consultar"
      },
      {
        "titulo": "Ciclo Ensambles",
        "fecha": "Domingos 23 y 30 de Noviembre",
        "horario": "17:00 hs",
        "lugar": "Sal√≥n de Honor",
        "descripcion": "Conciertos de diversos ensambles musicales",
        "categoria": "cultural",
        "tipo": "musica",
        "precio": "Consultar",
        "recurrente": true
      }
    ]
  },
  "paseos_recorridos_historicos": [
    {
      "titulo": "Visita a la Torre Monumental (Torre de los Ingleses)",
      "fecha": "Diario (Horario Variable)",
      "lugar": "Plaza de la Fuerza A√©rea Argentina",
      "descripcion": "La torre ofrece la posibilidad de subir a su mirador para obtener una vista panor√°mica de la zona, incluyendo la Estaci√≥n Retiro y el puerto",
      "categoria": "turismo",
      "tipo": "mirador",
      "precio": "Consultar"
    },
    {
      "titulo": "Parroquia Sant√≠simo Sacramento",
      "fecha": "Diario (Horario de Misa/Visita)",
      "lugar": "Marcelo T. de Alvear 1640",
      "direccion": "Marcelino de Elizondo 100",
      "descripcion": "Templo ic√≥nico del barrio, considerado uno de los m√°s lujosos de Argentina por su estilo. Es una visita arquitect√≥nica de gran inter√©s",
      "categoria": "turismo",
      "tipo": "arquitectura_religiosa",
      "precio": "Gratis"
    },
    {
      "titulo": "Palacio Paz (C√≠rculo Militar)",
      "fecha": "Mi√©rcoles y S√°bados (Consultar horarios)",
      "lugar": "Av. Santa Fe 750",
      "descripcion": "Este palacio es uno de los m√°s grandes y lujosos de Buenos Aires. Ofrece visitas guiadas que recorren sus salones ornamentados. Es necesario reservar previamente",
      "categoria": "turismo",
      "tipo": "arquitectura_historica",
      "precio": "Consultar",
      "nota": "Reserva previa necesaria"
    },
    {
      "titulo": "Museo de Arte Hispanoamericano Isaac Fern√°ndez Blanco",
      "fecha": "Mi√©rcoles (Gratis) y Fines de Semana",
      "lugar": "Palacio Noel",
      "direccion": "Suipacha 1422",
      "descripcion": "Aunque su sede principal est√° en Monserrat, el Palacio Noel en Retiro, dedicado al arte hispanoamericano, es una joya arquitect√≥nica",
      "categoria": "cultural",
      "tipo": "museo",
      "precio": "Mi√©rcoles gratis, consultar otros d√≠as"
    }
  ],
  "vida_nocturna": [
    {
      "zona": "Bares y Restaurantes de la Zona Catalinas",
      "descripcion": "Los bares ubicados en los edificios corporativos y los hoteles de alta gama (como el Sheraton o el Marriot Plaza) ofrecen un ambiente de after office animado los jueves y viernes por la tarde/noche",
      "categoria": "vida_nocturna",
      "tipo": "after_office",
      "dias_principales": ["jueves", "viernes"],
      "precio": "Premium"
    },
    {
      "zona": "Zona Esmeralda/San Mart√≠n",
      "descripcion": "La concentraci√≥n de oficinas y bancos en esta zona hace que las cervecer√≠as y bares sean puntos de encuentro social los d√≠as de semana",
      "categoria": "vida_nocturna",
      "tipo": "bares_cervecerias",
      "publico": "corporativo"
    }
  ],
  "iconos_turisticos": [
    {
      "nombre": "Torre Monumental (Torre de los Ingleses)",
      "tipo": "mirador"
    },
    {
      "nombre": "Palacio Libertad (Ex Correo Central)",
      "tipo": "centro_cultural"
    },
    {
      "nombre": "Parroquia Sant√≠simo Sacramento",
      "tipo": "templo_historico"
    },
    {
      "nombre": "Palacio Paz (C√≠rculo Militar)",
      "tipo": "palacio_historico"
    },
    {
      "nombre": "Estaci√≥n Retiro",
      "tipo": "centro_transporte"
    },
    {
      "nombre": "Plaza San Mart√≠n",
      "tipo": "plaza_historica"
    }
  ],
  "caracteristicas": {
    "enfoque": "historia_cultura_turismo",
    "ideal_para": ["turismo_cultural", "arquitectura", "musica_clasica", "historia"],
    "centro_transporte": true,
    "proximidad": ["Puerto Madero", "Recoleta"]
  },
  "total_eventos": 12,
  "respuesta_completa": "¬°Excelente! Retiro es un barrio clave que combina la historia, la cultura y un importante centro de transporte, lo que lo hace ideal para el turismo cultural.\n\nBasado en la agenda para lo que queda de noviembre de 2025 (desde hoy, domingo 9), aqu√≠ tienes los principales eventos y actividades en Retiro y sus alrededores inmediatos:\n\nüèõÔ∏è Eventos Culturales en Palacio Libertad (Ex Correo Central)\n\nEl Palacio Libertad (ex-Correo Central), lindero a Retiro, es un gran centro cultural con una agenda constante de cine, m√∫sica y exposiciones.\n\nEvento/Actividad\tFecha\tLugar\tNotas/Detalles\nLa Pampa C√≥smica de P√©rez Celis (Muestra)\tDesde el Mi√©rcoles 12 de Noviembre (Contin√∫a hasta Diciembre)\tSala Inmersiva\tExposici√≥n de 14:00 a 20:00 hs. Una experiencia inmersiva sobre la obra del artista argentino.\nConciertos del Mediod√≠a - Mozarteum Argentino\tMi√©rcoles 12 y 26 de Noviembre\tSala Argentina\tConciertos de m√∫sica cl√°sica de gran nivel. El 26/11, Sinfon√≠as de Mozart y Haydn. (14:00 hs).\nEl Camino de Manuelita (Familiar)\tS√°bados 15, 22 y 29 de Noviembre (Contin√∫a en Diciembre)\tSala Inmersiva\tExperiencia inmersiva para toda la familia sobre el personaje de Mar√≠a Elena Walsh. (14:00 a 20:00 hs).\nFestival Fado Buenos Aires 2025\tS√°bado 15 de Noviembre\tAuditorio Nacional\tConcierto en el marco del festival de m√∫sica portuguesa. (20:00 hs).\nHomenaje a Carlos Paredes (Fado)\tDomingo 16 de Noviembre\tSala Argentina\tConcierto especial de Andr√© Dias y Hugo Gamboias. (19:00 hs).\nTardes del Mundo: Flamenco\tViernes 21 de Noviembre\tPlaza Seca\tEspect√°culo de flamenco con Maxi Serral. (20:00 hs).\nDivas and Soul\tS√°bado 29 de Noviembre\tSala Argentina\tEspect√°culo musical de Soul. (20:00 hs).\nCiclo Ensambles\tDomingos 23 y 30 de Noviembre\tSal√≥n de Honor\tConciertos de diversos ensambles musicales. (17:00 hs).\n\nüé® Paseos y Recorridos Hist√≥ricos\n\nRetiro se presta mucho para el turismo hist√≥rico y la arquitectura, especialmente en la zona de Plaza San Mart√≠n y Canciller√≠a.\n\nActividad\tFecha\tLugar\tNotas/Detalles\nVisita a la Torre Monumental (Torre de los Ingleses)\tDiario (Horario Variable)\tPlaza de la Fuerza A√©rea Argentina\tLa torre ofrece la posibilidad de subir a su mirador para obtener una vista panor√°mica de la zona, incluyendo la Estaci√≥n Retiro y el puerto.\nParroquia Sant√≠simo Sacramento\tDiario (Horario de Misa/Visita)\tMarcelino de Elizondo 100\tTemplo ic√≥nico del barrio, considerado uno de los m√°s lujosos de Argentina por su estilo. Es una visita arquitect√≥nica de gran inter√©s.\nPalacio Paz (C√≠rculo Militar)\tMi√©rcoles y S√°bados (Consultar horarios)\tAvenida Santa Fe 750\tEste palacio es uno de los m√°s grandes y lujosos de Buenos Aires. Ofrece visitas guiadas que recorren sus salones ornamentados. Es necesario reservar previamente.\nMuseo de Arte Hispanoamericano Isaac Fern√°ndez Blanco\tMi√©rcoles (Gratis) y Fines de Semana\tSede Palacio Noel (Suipacha 1422, cercano a Retiro)\tAunque su sede principal est√° en Monserrat, el Palacio Noel en Retiro, dedicado al arte hispanoamericano, es una joya arquitect√≥nica que puedes visitar.\n\nüí° Fiestas y Vida Nocturna\n\nRetiro, por su ubicaci√≥n cercana a Puerto Madero y Recoleta, comparte una oferta de vida nocturna sofisticada, aunque se concentra m√°s en los bares de hoteles y restaurantes premium que en boliches masivos:\n\nBares y Restaurantes de la Zona Catalinas: Los bares ubicados en los edificios corporativos y los hoteles de alta gama (como el Sheraton o el Marriot Plaza) ofrecen un ambiente de after office animado los jueves y viernes por la tarde/noche.\n\nZona Esmeralda/San Mart√≠n: La concentraci√≥n de oficinas y bancos en esta zona hace que las cervecer√≠as y bares sean puntos de encuentro social los d√≠as de semana.\n\n¬øTe gustar√≠a que investigue los horarios espec√≠ficos de las visitas guiadas en el Palacio Paz o en la Torre Monumental para alguna fecha de la semana que te interese?"
}
