{
  "barrio": "Parque Chas",
  "comuna": 15,
  "zona": "Norte",
  "mes": "noviembre",
  "a√±o": 2025,
  "fecha_consulta": "2025-11-09",
  "fuente": "Gemini AI",
  "notas_importantes": [
    "El barrio de Parque Chas celebr√≥ su Centenario recientemente (cumpli√≥ 100 a√±os en septiembre de 2025)",
    "Muchos de los festejos m√°s grandes se realizaron los d√≠as previos (ej. el 2 de noviembre)",
    "Es probable que la agenda inmediata tenga menos eventos centrales"
  ],
  "eventos_locales": [
    {
      "titulo": "Festival en La Terraza",
      "fecha": "2025-11-08",
      "horario": "20:00 hrs",
      "lugar": "La Terraza Club",
      "direccion": "Arismendi 2686",
      "notas": "Aunque la fecha es del 8 de noviembre (d√≠a anterior a la consulta), a veces este tipo de eventos se repiten. Podr√≠a ser √∫til consultar directamente al lugar si hay alguna actividad similar programada para el resto del mes.",
      "categoria": "entretenimiento"
    }
  ],
  "eventos_culturales_caba": [
    {
      "titulo": "Clases de Tango",
      "fecha": "Viernes 14, 21 y 28 de Noviembre",
      "horario": "12:00 a 13:30 hs",
      "lugar": "Sal√≥n Presidente Per√≥n",
      "direccion": "Legislatura CABA",
      "precio": "Gratis",
      "categoria": "cultural",
      "tipo": "danza"
    },
    {
      "titulo": "Ensayo del Coro de la Legislatura",
      "fecha": "Lunes y Mi√©rcoles (consultar fechas exactas)",
      "horario": "17:00 a 19:00 hs",
      "lugar": "Sal√≥n Presidente Per√≥n",
      "direccion": "Legislatura CABA",
      "precio": "Gratis",
      "categoria": "cultural",
      "tipo": "musica"
    },
    {
      "titulo": "Encuentro Coral",
      "fecha": "2025-11-12",
      "horario": "18:00 hs (Ingreso 17:30 hs)",
      "lugar": "Sal√≥n Presidente Per√≥n",
      "direccion": "Legislatura CABA",
      "precio": "Gratis",
      "categoria": "cultural",
      "tipo": "musica"
    },
    {
      "titulo": "M√∫sica Cl√°sica (Orquesta a confirmar)",
      "fecha": "2025-11-17",
      "horario": "18:00 hs (Ingreso 17:30 hs)",
      "lugar": "Sal√≥n Presidente Per√≥n",
      "direccion": "Legislatura CABA",
      "precio": "Gratis",
      "categoria": "cultural",
      "tipo": "musica"
    },
    {
      "titulo": "Pe√±a Porte√±a (Folclore)",
      "fecha": "2025-11-18",
      "lugar": "Sal√≥n Presidente Per√≥n",
      "direccion": "Legislatura CABA",
      "precio": "Gratis",
      "categoria": "cultural",
      "tipo": "musica"
    },
    {
      "titulo": "LegisRock (Distinci√≥n a EL RELOJ)",
      "fecha": "2025-11-19",
      "lugar": "Sal√≥n Montevideo",
      "direccion": "Legislatura CABA",
      "precio": "Gratis",
      "categoria": "cultural",
      "tipo": "musica"
    },
    {
      "titulo": "M√∫sica Cl√°sica (Orquesta de J√≥venes Solistas)",
      "fecha": "2025-11-25",
      "horario": "18:00 hs (Ingreso 17:30 hs)",
      "lugar": "Sal√≥n Presidente Per√≥n",
      "direccion": "Legislatura CABA",
      "precio": "Gratis",
      "categoria": "cultural",
      "tipo": "musica"
    }
  ],
  "sugerencias_adicionales": [
    {
      "tipo": "paseo",
      "descripcion": "Parque Chas es conocido por su dise√±o laber√≠ntico. Una actividad interesante es hacer un recorrido autoguiado o tem√°tico para descubrir sus calles circulares y su arquitectura",
      "lugar_emblematico": "Plaza √âxodo Juje√±o"
    },
    {
      "tipo": "actividad_vecinal",
      "lugar": "Biblioteca Popular El Resplandor",
      "direccion": "Club SABER (Llerena 2727)",
      "descripcion": "Suele tener actividades vecinales, reuniones, y encuentros. Consultar cartelera o redes sociales."
    }
  ],
  "total_eventos": 8,
  "respuesta_completa": "¬°Hola! Basado en la informaci√≥n disponible para Parque Chas y la Ciudad de Buenos Aires en general, te comento los eventos que podr√≠an ser de inter√©s desde hoy, 9 de noviembre de 2025 hasta fin de mes:\n\nüóìÔ∏è Eventos y Actividades en Parque Chas (o muy cerca)\n\nEvento\tFecha\tLugar\tNotas/Detalles\nFestival en La Terraza\tS√°bado 8 de Noviembre de 2025 (20:00 hrs)\tLa Terraza Club (Arismendi 2686)\tAunque la fecha es del 8 de noviembre, que fue ayer, a veces este tipo de eventos se repiten. Podr√≠a ser √∫til consultar directamente al lugar si hay alguna actividad similar programada para el resto del mes.\n\nNota Importante: El barrio de Parque Chas celebr√≥ su Centenario recientemente (cumpli√≥ 100 a√±os en septiembre de 2025), y muchos de los festejos m√°s grandes (como la \"Fiesta central de los 100 a√±os\" en la Plaza √âxodo Juje√±o y el Corso) se realizaron los d√≠as previos a hoy (ej. el 2 de noviembre). Es probable que la agenda inmediata tenga menos eventos centrales.\n\nüèõÔ∏è Actividades Culturales en la Ciudad (CABA)\n\nSi est√°s dispuesto a moverte un poco, la Legislatura de la Ciudad de Buenos Aires suele tener una agenda cultural amplia y gratuita en noviembre, que incluye:\n\nActividad\tFecha\tLugar\tHorario\nClases de Tango\tViernes (consulta por el 14, 21 y 28 de Noviembre)\tSal√≥n Presidente Per√≥n (Legislatura CABA)\t12:00 a 13:30 hs\nEnsayo del Coro de la Legislatura\tLunes y Mi√©rcoles (consulta fechas exactas)\tSal√≥n Presidente Per√≥n (Legislatura CABA)\t17:00 a 19:00 hs\nEncuentro Coral\tLunes 12 de Noviembre\tSal√≥n Presidente Per√≥n (Legislatura CABA)\t18:00 hs (Ingreso 17:30 hs)\nM√∫sica Cl√°sica (Orquesta a confirmar)\tLunes 17 de Noviembre\tSal√≥n Presidente Per√≥n (Legislatura CABA)\t18:00 hs (Ingreso 17:30 hs)\nPe√±a Porte√±a (Folclore)\tMartes 18 de Noviembre\tSal√≥n Presidente Per√≥n (Legislatura CABA)\t-\nLegisRock (Distinci√≥n a EL RELOJ)\tMi√©rcoles 19 de Noviembre\tSal√≥n Montevideo (Legislatura CABA)\t-\nM√∫sica Cl√°sica (Orquesta de J√≥venes Solistas)\tLunes 25 de Noviembre\tSal√≥n Presidente Per√≥n (Legislatura CABA)\t18:00 hs (Ingreso 17:30 hs)\n\nImportante: Las actividades de la Legislatura son con entrada libre y gratuita, solo se requiere presentar DNI para ingresar.\n\nüí° Otras Ideas en el Barrio o Cercanas\n\nPaseos y Recorridos: Parque Chas es conocido por su dise√±o laber√≠ntico. Una actividad interesante es hacer un recorrido autoguiado o tem√°tico para descubrir sus calles circulares y su arquitectura, visitando lugares emblem√°ticos como la Plaza √âxodo Juje√±o.\n\nBiblioteca Popular El Resplandor: Ubicada en el Club SABER (Llerena 2727), suele tener actividades vecinales, reuniones, y encuentros. Podr√≠as consultar su cartelera o redes sociales.\n\n¬øTe gustar√≠a que intente buscar la agenda de alg√∫n club de barrio espec√≠fico en Parque Chas (como el Club El Tr√©bol o el Club SABER) para ver si tienen alguna pe√±a o actividad bailable programada para lo que resta de noviembre?"
}
